{
    "lastmod": "2025-6-7",
    "page_url": "",
    "page_title": "Aa denticulata",
    "plant_slug": "aa-denticulata",
    "plant_name_scientific": "aa denticulata",
    "intro": "Aa denticulata, commonly known as the Hawaiian mountain apple tree, is a species of flowering plant native to the island of Hawaii. It belongs to the Moraceae family, which includes figs and mulberries, and is characterized by its broad, heart-shaped leaves. The plant produces small, greenish-white flowers that are clustered in inflorescences, followed by round, green fruits that turn red when ripe. Aa denticulata is well adapted to the volcanic soils and rugged terrain of Hawaii's high elevations. It plays an important ecological role in the native forest ecosystems of the islands.",
    "taxonomy": {
        "kingdom": "Plantae",
        "phylum": "Streptophyta",
        "class": "Equisetopsida",
        "subclass": "Magnoliidae",
        "order": "Asparagales",
        "family": "Orchidaceae",
        "genus": "Aa",
        "species": "Aa denticulata"
    },
    "taxonomy_art_desc": "Aa denticulata belongs to the kingdom Plantae. Its phylum is Streptophyta, which includes land plants and algae that have a complex life cycle with alternating generations. Its class is Equisetopsida, which consists of vascular plants that include ferns and their allies. Its subclass is Magnoliidae, a group of flowering plants characterized by their complex floral structures and diverse adaptations. Its order is Asparagales, which includes a wide range of flowering plants such as orchids, asparagus, and lilies. Its family is Orchidaceae, commonly known as orchids, which are known for their intricate and often showy flowers. Its genus is Aa, a group of orchids native to certain regions of the world, often characterized by specific morphological features. Its species is Aa denticulata, a particular type of orchid distinguished by its unique physical traits and habitat preferences.",
    "distribution-native": [
        "Colombia",
        "Ecuador"
    ],
    "distribution-introduced": [],
    "distribution_native": [
        "Colombia",
        "Ecuador"
    ],
    "distribution_introduced": [],
    "distribution_native_art_desc": "Aa denticulata is primarily native to Colombia and Ecuador. This plant is commonly found in the Andean regions of these countries. It thrives in high-altitude environments, often in cloud forests and mountainous areas. The species is adapted to the cool and humid conditions of its native habitat. Its distribution is limited to specific ecological zones within these South American nations.",
    "distribution_introduced_art_desc": "Aa denticulata was mainly introduced to new habitats in the Pacific Islands through human activity, including trade and colonization. It has since become an invasive species in several regions, outcompeting native flora for resources. The plant thrives in disturbed soils and coastal areas, making it particularly problematic in ecologically sensitive zones. Its rapid growth and ability to form dense stands have led to concerns about its impact on biodiversity. Efforts to control its spread include mechanical removal and the use of targeted herbicides."
}
