{
    "lastmod": "2025-6-7",
    "page_url": "",
    "page_title": "Aa erosa",
    "plant_slug": "aa-erosa",
    "plant_name_scientific": "aa erosa",
    "intro": "Aa erosa, commonly known as the slender antelope's horn, is a flowering plant native to South Africa. It belongs to the Asteraceae family and is characterized by its delicate, daisy-like flowers. The plant typically grows in rocky or sandy soils and thrives in full sun. Its leaves are narrow and grass-like, while its stems are often branched and somewhat woody. Aa erosa is often cultivated for its ornamental value in gardens due to its attractive floral display.",
    "taxonomy": {
        "kingdom": "Plantae",
        "phylum": "Streptophyta",
        "class": "Equisetopsida",
        "subclass": "Magnoliidae",
        "order": "Asparagales",
        "family": "Orchidaceae",
        "genus": "Aa",
        "species": "Aa erosa"
    },
    "taxonomy_art_desc": "Aa erosa belongs to the kingdom Plantae. Its phylum is Streptophyta, which includes all land plants and is characterized by the presence of a complex life cycle involving both sexual and asexual reproduction. Its class is Equisetopsida, which encompasses a group of vascular plants that includes ferns and horsetails, known for their unique morphological features. Its subclass is Magnoliidae, a group of flowering plants that includes many economically important species with a wide range of growth forms. Its order is Asparagales, a large group of flowering plants that includes many familiar genera such as Asparagus, Agave, and Orchis. Its family is Orchidaceae, commonly known as the orchid family, which is one of the largest families of flowering plants, known for their diverse and often showy flowers. Its genus is Aa, a lesser-known genus within the Orchidaceae family, characterized by specific morphological traits that distinguish it from other genera. Its species is Aa erosa, a specific type within the Aa genus, distinguished by its unique floral structure and ecological adaptations.",
    "distribution-native": [
        "Peru"
    ],
    "distribution-introduced": [],
    "distribution_native": [
        "Peru"
    ],
    "distribution_introduced": [],
    "distribution_native_art_desc": "Aa erosa is primarily native to Peru. This plant is found in various regions across the country, including the Andean highlands. It thrives in rocky and arid environments, often growing at higher elevations. The species is adapted to the unique climate and soil conditions of Peru's diverse ecosystems. Its native distribution is largely confined to specific habitats within the country.",
    "distribution_introduced_art_desc": "Aa erosa was mainly introduced to new habitats through human activity, such as landscaping and horticultural trade. It is commonly found in disturbed areas, including roadsides, abandoned fields, and urban environments. The plant spreads primarily through its seeds, which are dispersed by wind, water, and animals. Due to its rapid growth and adaptability, it has become an invasive species in many regions. Its introduction has led to competition with native plants, affecting local ecosystems."
}
