{
    "lastmod": "2025-6-7",
    "page_url": "",
    "page_title": "Aa fiebrigii",
    "plant_slug": "aa-fiebrigii",
    "plant_name_scientific": "aa fiebrigii",
    "intro": "Aa fiebrigii, commonly known as the giant lily, is a striking plant native to the high altitudes of the Himalayas. It is characterized by its massive, white, trumpet-shaped flowers that can reach up to 30 centimeters in length. The plant thrives in cool, moist environments and requires well-drained soil to prevent root rot. Its leaves are large, broad, and often covered in a waxy coating to reduce water loss. Aa fiebrigii is a rare and endangered species, making it a subject of interest for botanists and conservationists alike.",
    "taxonomy": {
        "kingdom": "Plantae",
        "phylum": "Streptophyta",
        "class": "Equisetopsida",
        "subclass": "Magnoliidae",
        "order": "Asparagales",
        "family": "Orchidaceae",
        "genus": "Aa",
        "species": "Aa fiebrigii"
    },
    "taxonomy_art_desc": "Aa fiebrigii belongs to the kingdom Plantae. Its phylum is Streptophyta, which includes land plants and is characterized by the presence of true roots, stems, and leaves. Its class is Equisetopsida, which consists of vascular plants that include horsetails and their relatives. Its subclass is Magnoliidae, a group of flowering plants that includes many economically important species. Its order is Asparagales, a group of flowering plants that includes many familiar plants such as orchids and asparagus. Its family is Orchidaceae, commonly known as the orchid family, which is known for its diverse and often showy flowers. Its genus is Aa, a group of flowering plants that includes several species with unique floral structures. Its species is Aa fiebrigii, a specific type of orchid known for its distinctive appearance and ecological significance.",
    "distribution-native": [
        "Argentina Northwest",
        "Bolivia"
    ],
    "distribution-introduced": []
}
