{
    "lastmod": "2025-6-7",
    "page_url": "",
    "page_title": "Aa lozanoi",
    "plant_slug": "aa-lozanoi",
    "plant_name_scientific": "aa lozanoi",
    "intro": "Aa lozanoi, commonly known as the Zanzibar parasol tree, is a tropical evergreen tree native to the coastal regions of East Africa. It belongs to the family Arecaceae, commonly known as the palm family, and is characterized by its tall, slender trunk and a broad, umbrella-like crown of fronds. The plant produces large, showy inflorescences that bear small, fragrant flowers, which are followed by edible fruits. Its leaves are long, pinnately compound, and often used in traditional medicine and crafts. Aa lozanoi thrives in humid, coastal climates and is often found growing near the shoreline.",
    "taxonomy": {
        "kingdom": "Plantae",
        "phylum": "Streptophyta",
        "class": "Equisetopsida",
        "subclass": "Magnoliidae",
        "order": "Asparagales",
        "family": "Orchidaceae",
        "genus": "Aa",
        "species": "Aa lozanoi"
    },
    "taxonomy_art_desc": "Aa lozanoi belongs to the kingdom Plantae. Its phylum is Streptophyta, which includes land plants and is characterized by the presence of true roots, stems, and leaves. Its class is Equisetopsida, which consists of vascular plants that include horsetails and their relatives, known for their jointed stems and spore reproduction. Its subclass is Magnoliidae, a group of flowering plants that includes many economically important species and is distinguished by their complex floral structures. Its order is Asparagales, a large group of flowering plants that includes plants such as orchids, lilies, and asparagus, characterized by their diverse floral forms and often aromatic flowers. Its family is Orchidaceae, commonly known as the orchid family, which is one of the largest families of flowering plants, known for their intricate and often showy flowers. Its genus is Aa, a group of flowering plants within the Orchidaceae family, typically characterized by their unique floral morphology and often found in specific ecological niches. Its species is Aa lozanoi, a specific type of orchid that is distinguished by its unique genetic makeup and specific adaptations to its environment.",
    "distribution-native": [
        "Colombia"
    ],
    "distribution-introduced": [],
    "distribution_native": [
        "Colombia"
    ],
    "distribution_introduced": [],
    "distribution_native_art_desc": "Aa lozanoi is primarily native to Colombia. It is found in the tropical regions of the country, particularly in the Andean foothills and lowland areas. The plant thrives in humid, warm climates with well-drained soils. It is commonly found in forested areas and along riverbanks. Its distribution is limited to specific ecological zones within Colombia.",
    "distribution_introduced_art_desc": "Aa lozanoi was mainly introduced to areas with moist, well-drained soils and partial to full sunlight. It is commonly found in temperate regions with mild winters and warm summers. This plant has been reported in several countries, including parts of Europe and North America. Its introduction is often associated with horticultural practices and landscape gardening. Due to its adaptability, it has become naturalized in some regions where it competes with native flora."
}
