{
    "lastmod": "2025-6-7",
    "page_url": "",
    "page_title": "Aa riobambae",
    "plant_slug": "aa-riobambae",
    "plant_name_scientific": "aa riobambae",
    "intro": "Aa riobambae, commonly known as the Rio Bambae palm, is a rare and unique plant native to the tropical regions of South America. It belongs to the Arecaceae family and is characterized by its tall, slender trunk and large, feather-like leaves. The plant thrives in humid, warm climates and is often found in riverine habitats. Its roots system is adapted to absorb nutrients from the nutrient-poor soils of its native environment. Due to its limited distribution and habitat specificity, it is considered a vulnerable species.",
    "taxonomy": {
        "kingdom": "Plantae",
        "phylum": "Streptophyta",
        "class": "Equisetopsida",
        "subclass": "Magnoliidae",
        "order": "Asparagales",
        "family": "Orchidaceae",
        "genus": "Aa",
        "species": "Aa riobambae"
    },
    "taxonomy_art_desc": "Aa riobambae belongs to the kingdom Plantae. Its phylum is Streptophyta, which includes land plants and is characterized by the presence of true roots, stems, and leaves. Its class is Equisetopsida, which comprises ferns and their allies, known for their vascular systems and spore reproduction. Its subclass is Magnoliidae, a group of flowering plants that includes many economically important species with a wide range of morphological diversity. Its order is Asparagales, a group of monocot flowering plants that includes well-known genera such as Asparagus and Orchids. Its family is Orchidaceae, commonly known as the orchid family, which is one of the largest families of flowering plants with a high degree of morphological and ecological diversity. Its genus is Aa, a relatively small genus of orchids native to the Andes, characterized by their unique floral structures and habitat preferences. Its species is Aa riobambae, a rare and endemic orchid found in specific regions of South America, notable for its distinctive appearance and ecological significance.",
    "distribution-native": [
        "Colombia",
        "Ecuador"
    ],
    "distribution-introduced": [],
    "distribution_native": [
        "Colombia",
        "Ecuador"
    ],
    "distribution_introduced": [],
    "distribution_native_art_desc": "Aa riobambae is primarily native to Colombia and Ecuador. This plant is found in the Andean regions of these countries. It typically grows in high-altitude areas with cool, moist climates. The species is often associated with cloud forests and mountainous terrain. Its distribution is limited to specific ecological niches within these regions.",
    "distribution_introduced_art_desc": "Aa riobambae was mainly introduced to areas with high humidity and well-drained soils, typically found in tropical and subtropical regions. It thrives in warm climates with ample sunlight and is often cultivated for its ornamental value. The plant is commonly found in gardens and greenhouses where it can grow vigorously. Due to its rapid growth and adaptability, it has been introduced to several countries outside its native range. However, its spread can sometimes lead to ecological concerns if it becomes invasive in new environments."
}
