{
    "lastmod": "2025-6-7",
    "page_url": "",
    "page_title": "Aa rosei",
    "plant_slug": "aa-rosei",
    "plant_name_scientific": "aa rosei",
    "intro": "Aa rosei, commonly known as the Hawaiian rose, is a flowering plant native to the Hawaiian Islands. It belongs to the Rubiaceae family and is characterized by its fragrant, showy flowers that bloom in shades of white and pink. The plant typically grows in coastal areas and has adapted to the unique climate and soil conditions of Hawaii. Its leaves are opposite and oval-shaped, often with a slight pubescence. Aa rosei is an important part of Hawaii's native flora and is sometimes cultivated for its ornamental value.",
    "taxonomy": {
        "kingdom": "Plantae",
        "phylum": "Streptophyta",
        "class": "Equisetopsida",
        "subclass": "Magnoliidae",
        "order": "Asparagales",
        "family": "Orchidaceae",
        "genus": "Aa",
        "species": "Aa rosei"
    },
    "taxonomy_art_desc": "Aa rosei belongs to the kingdom Plantae. Its phylum is Streptophyta, which includes land plants and is characterized by the presence of true stems, roots, and leaves. Its class is Equisetopsida, which consists of vascular plants that include horsetails and their relatives, known for their jointed stems and spore reproduction. Its subclass is Magnoliidae, a group of flowering plants that includes many economically important species, characterized by their complex floral structures. Its order is Asparagales, a large group of flowering plants that includes plants such as orchids, asparagus, and grasses, known for their diverse growth forms and ecological roles. Its family is Orchidaceae, commonly known as the orchid family, which is one of the largest families of flowering plants, characterized by their intricate and often showy flowers. Its genus is Aa, a group of flowering plants within the Orchidaceae family, known for their unique floral morphology and specialized pollination mechanisms. Its species is Aa rosei, a specific type of orchid within the Aa genus, distinguished by its particular floral characteristics and habitat preferences.",
    "distribution-native": [
        "Peru"
    ],
    "distribution-introduced": [],
    "distribution_native": [
        "Peru"
    ],
    "distribution_introduced": [],
    "distribution_native_art_desc": "Aa rosei is primarily native to Peru. It is found in the Andean regions of the country, particularly in the highlands and mountainous areas. This plant thrives in temperate climates with well-drained soil. It is commonly found in scrublands and open grassy areas. Its distribution is limited to specific ecological zones within Peru.",
    "distribution_introduced_art_desc": "Aa rosei was mainly introduced to new environments through human activity, such as horticulture and landscaping. It is commonly found in regions with temperate climates, including parts of North America and Europe. The plant has adapted well to these areas, often thriving in well-drained soils and full sun. Its introduction has led to its establishment in both urban and rural settings. However, it is considered an invasive species in some regions due to its rapid growth and competitive nature."
}
